Title,ReplyIndex,CrawlingTime,Content,Like,Hate
[재난지원금 Q&A①]통신비 9월 요금서 2만원 차감…1인 1대…,13,2020.9.16 0:34,조선족들 중국인 외국인 긴급생계비지원하면서 이나라에서 나고자란 국민들은 2만원 참 웃긴정권이다,10,0
[재난지원금 Q&A①]통신비 9월 요금서 2만원 차감…1인 1대…,14,2020.9.16 0:34,통신요금 이건 진짜 왜 주는건지... 이건 정치라고 밖에 볼 수없는듯. 아프거나 진짜 소외계층 도우면 진짜 감사할듯.,10,0
[재난지원금 Q&A①]통신비 9월 요금서 2만원 차감…1인 1대…,15,2020.9.16 0:34,골때리는 정부~~국민대다수가 반대하는 짓거리만하는구만~국민건강을 위해 국민에게 독감백신 접종해주면 얼마나 좋아~얼마나 건강한 생각이냐구~~이렇게 소통이안되는 정부를 믿고 어떻게 살아가야하나~~이젠 지쳐서 욕두 안나온다~이놈의 정권만 끝나길 학수고대할뿐~~,10,1
[재난지원금 Q&A①]통신비 9월 요금서 2만원 차감…1인 1대…,16,2020.9.16 0:34,안해줘도 된다는거 왜 굳이...,9,0
[재난지원금 Q&A①]통신비 9월 요금서 2만원 차감…1인 1대…,17,2020.9.16 0:34,2만원 받고 3만원 뱉을듯,10,2
[재난지원금 Q&A①]통신비 9월 요금서 2만원 차감…1인 1대…,18,2020.9.16 0:34,차라리 독감주사나 무료로 놔달라니깐......,8,0
[재난지원금 Q&A①]통신비 9월 요금서 2만원 차감…1인 1대…,19,2020.9.16 0:34,어이없다..자식들 핸폰은 부모 명의데...왜 저따위지,8,0
[재난지원금 Q&A①]통신비 9월 요금서 2만원 차감…1인 1대…,20,2020.9.16 0:34,해주고도 욕얻어 먹는짓 하네진짜로,8,0
[앵커의 눈] 삼성·LG에 부품업체도 타격…수요 이동 ‘기대…,1,2020.9.16 0:34,"미국과 중국의 경제전쟁으로 우리나라 기업이 피해를 보게되어 정말 안타깝습니다. 대기업인 삼성, LG, SK의 중국 수출길이 막히면 그 밑에 작은 부품 회사들도 큰 타격을 받게 되네요. 코로나로 전세계가 힘든데, 미중 경제전쟁과 보복으로 더 힘들어진 우리나라 모든 기업들! 기운내세요. 항상 응원하겠습니다.",80,8
[앵커의 눈] 삼성·LG에 부품업체도 타격…수요 이동 ‘기대…,2,2020.9.16 0:34,"특히 주목해야 한 점은 코로나! 우한연구소에서 우한바이러스 유출했다는 증거를 가지고 있다는 연구원이 얼마전 미국으로 망명했음. 우한연구소 유출 증명되면, 세계 각국에서 피해 보상금 청구할텐데, 중국에 위기가 올것임. 이제 친중에서 친미로 가야할 때임. 아마도 미국에서 이를 핑계로 대북제재보다도 막강한 대중제재가 나올 듯함. 기업들은 이에 대비해서 대응방안을 마련해야함. 최소한 현재 추진하고 있는 중국 투자를 보류해야 하지 않을까 생각함.",35,2
[앵커의 눈] 삼성·LG에 부품업체도 타격…수요 이동 ‘기대…,3,2020.9.16 0:34,미국이 만든 룰에 놀고 싶고.. 반칙은 하고..미국 최고의 상품은 뭔가... 유튜브 페이스북등... 중국은 다 막죠.. 고스톱도 동네 룰이 있음.. 놀고 싶으면 룰을 지켜야지.. 왜 반칙을함.. 반칙을 하니 안끼워 주는것 아닙니까. 자꾸 편법 위법을 쓰니,27,3
[앵커의 눈] 삼성·LG에 부품업체도 타격…수요 이동 ‘기대…,4,2020.9.16 0:34,"삼성전자 최대의 경쟁자를 없애주겠다는데 저런 기사 쏟아내네 ㅋㅋ 화웨이가 이미 반도체 사재기해놔서 매출 미리 다 뽑았고, 화웨이꺼 5g 매출 가져올게 뻔히보이는데다가, 중국에서 삼성전자 휴대폰 시장점유율도 낮은데 뭔 상관입니까 ㅋㅋㅋ",25,1
[앵커의 눈] 삼성·LG에 부품업체도 타격…수요 이동 ‘기대…,5,2020.9.16 0:34,멀리 보고 대국적 견지에서 생각해야 할듯 합니다.우선은 대 화웨이 수출이 줄겠지만 장차는 큰 수익으로 돌아 올게 분명합니다.,21,2
[앵커의 눈] 삼성·LG에 부품업체도 타격…수요 이동 ‘기대…,6,2020.9.16 0:34,앵커의눈이 삐꾸니? 화웨이는 소비자이기도하지만 최대 경쟁상대야 그것도 반칙만 일삼는 야비한 쓰레기 일시적 매출감소는 있지만 장기적으로 국가호재야 중국몽문재인한테는 악재겠지만 ㅎ,6,3
[앵커의 눈] 삼성·LG에 부품업체도 타격…수요 이동 ‘기대…,7,2020.9.16 0:34,내 짪은소견으론 지금 화웨이를 꺽지 못하면 세계가 잠식당한다 첫째로 중국은 공산국가다. 결국 화웨이도 국가서 움직인다. 힘이 강해질수록 중국은 무역보복으로 한라라를 휘청인다. 또 끌려가고 결국 중화제일 인민 공화국을 꿈꾸는게 실현될수도 인구가 많기에 정말로 견제가 없다면 정말 우리 후대에는 굽신거리며 살아야한다. 지금 미국의 경제 전쟁이 나뿐것만은 아니다. 그러니 제발 한쪽으로 너무 쏠림은 안좋다. 특히 중국,3,0
[앵커의 눈] 삼성·LG에 부품업체도 타격…수요 이동 ‘기대…,8,2020.9.16 0:34,이게 사실 하청들만 죽어남,2,0
[앵커의 눈] 삼성·LG에 부품업체도 타격…수요 이동 ‘기대…,9,2020.9.16 0:34,만세를 불러도 시원찮은 이 상황에 왜 징징거리나. 도대체 생각 좀하고 분석 좀하고 기사써라. 내 기술 홈쳐다가 장사하던 앞집 놈이 망했단 말이다. 소비자 시장이 도대체 파이가 소멸 되냐고. 참 어처구니가 없다.,2,0
[앵커의 눈] 삼성·LG에 부품업체도 타격…수요 이동 ‘기대…,10,2020.9.16 0:34,뭐 이런 기사를 화웨이에 못하는 수출 미국 버라이즌에10조 이미 했자나 화웨이가 없으니 시장은 더 늘었고 어차피 시장은 다각화 해야할건데 이기회에 트럼프 엎고 미국.유럽 전부 경쟁 할수 있는데 뭐가 악재야?중국에만 팔아야 하나?기자 중국 그만 빨아라,3,2
[앵커의 눈] 삼성·LG에 부품업체도 타격…수요 이동 ‘기대…,11,2020.9.16 0:34,좋아요ㅡ아주좋아 삼성 연봉부러워했는데,2,1
[앵커의 눈] 삼성·LG에 부품업체도 타격…수요 이동 ‘기대…,12,2020.9.16 0:34,삼성 매출이 년 300조에 달하는데 ... 중국 그만 빨아라,2,1
[앵커의 눈] 삼성·LG에 부품업체도 타격…수요 이동 ‘기대…,13,2020.9.16 0:34,언어가 같은 사람끼리도 갈등잇는데 언어가 다른 사람들끼리 갈등 잇는건 당연하다.국가끼리의 갈등에 대비해서 수출은 어느 한국가에만 의존하지 않아야한다.,1,0
[앵커의 눈] 삼성·LG에 부품업체도 타격…수요 이동 ‘기대…,14,2020.9.16 0:34,중국거 쓰는 정신 못차리는 LG 전자도 좀 처맞아야 된다.,1,0
[앵커의 눈] 삼성·LG에 부품업체도 타격…수요 이동 ‘기대…,15,2020.9.16 0:34,미국이 중국제재하는데 우리가 왜 못 파는겨?,1,1
[앵커의 눈] 삼성·LG에 부품업체도 타격…수요 이동 ‘기대…,16,2020.9.16 0:34,화웨이가 만들어서 팔 물건 다른 곳에서 만들어 팔겠지 거기에 부품팔면된다. 뭔 걱정이냐,1,1
[앵커의 눈] 삼성·LG에 부품업체도 타격…수요 이동 ‘기대…,17,2020.9.16 0:34,중국엄청빨아데네 두고보셔 별탈 없을테니...,1,1
[앵커의 눈] 삼성·LG에 부품업체도 타격…수요 이동 ‘기대…,18,2020.9.16 0:34,이제보면 삼성이 하청업체를 쥐어짜기 어떻게든 손해안보려고 신사적인면을 버리고 하청업체죽이기 단가 쥐어짜기 시작됩니다!!!!실적문제 해결이안되면 동시 다발적인 탄성이 나올거예요,0,0
[앵커의 눈] 삼성·LG에 부품업체도 타격…수요 이동 ‘기대…,19,2020.9.16 0:34,적절한 타이밍에 화웨이 거래중단/중국 공산당 경영 화웨이는 이제 맛이갑니다. KBS 친중기자님 세계 흐름좀 파악하고 기사쓰시길/ 미국이 화웨이 재제하는데 삼성전자 주식은 왜오를까요? 경제 논리를 모르면 경제기사는 자제하시길,0,0
"[영상]車 돌진뒤 20분간 편의점 뭉개…30대女 난동, 공포탄 …경기도 평택에 있는 한 편의점 안으로 승용차를 몰고 돌진한 뒤 앞뒤로 운전하는 등 난동을 벌인 30대 여성 운전자가 경찰에 …",1,2020.9.16 0:34,별 제 정신 아닌 인간들 많다 편의점을 박살 내놨네..택배 사라졌다고 암만 화가 난다고 저러면 되나 지 인생 망치고 다른 사람 가게 망치고 지 차도 망치고 그냥 감옥에서 사는게 저 인간 인생을 위해 낫겠다..,1792,13
"[영상]車 돌진뒤 20분간 편의점 뭉개…30대女 난동, 공포탄 …경기도 평택에 있는 한 편의점 안으로 승용차를 몰고 돌진한 뒤 앞뒤로 운전하는 등 난동을 벌인 30대 여성 운전자가 경찰에 …",2,2020.9.16 0:34,내 참 별... 요새 감정 컨트롤 못하는 인간이 왜 이리 많누,615,1
"[영상]車 돌진뒤 20분간 편의점 뭉개…30대女 난동, 공포탄 …경기도 평택에 있는 한 편의점 안으로 승용차를 몰고 돌진한 뒤 앞뒤로 운전하는 등 난동을 벌인 30대 여성 운전자가 경찰에 …",3,2020.9.16 0:34,경찰 이20분동안 보고 있었다고 하는게 말이됩니까,644,97
"[영상]車 돌진뒤 20분간 편의점 뭉개…30대女 난동, 공포탄 …경기도 평택에 있는 한 편의점 안으로 승용차를 몰고 돌진한 뒤 앞뒤로 운전하는 등 난동을 벌인 30대 여성 운전자가 경찰에 …",4,2020.9.16 0:34,미국이였으면벌써저세상갔을텐데법이너무약해,430,9
"[영상]車 돌진뒤 20분간 편의점 뭉개…30대女 난동, 공포탄 …경기도 평택에 있는 한 편의점 안으로 승용차를 몰고 돌진한 뒤 앞뒤로 운전하는 등 난동을 벌인 30대 여성 운전자가 경찰에 …",5,2020.9.16 0:34,음주운전은 아닌 듯 한데.... 분노 조절이 안 되는 것인지 약기운에 한 짓인지는 모르겠지만 차로 상대방을 위협한 사건이기 때문에 강한 처벌을 받아야 한다! 차가 흉기다! 고의적으로 위협한 사건이기에 가벼운 처벌은 못 받는다! 경찰이 공포탄을 쏠 정도면 강압적으로 제압한 사건이다! 젊은 사람이 순간의 분노로 인생 망치게 되었다.,246,11
"[영상]車 돌진뒤 20분간 편의점 뭉개…30대女 난동, 공포탄 …경기도 평택에 있는 한 편의점 안으로 승용차를 몰고 돌진한 뒤 앞뒤로 운전하는 등 난동을 벌인 30대 여성 운전자가 경찰에 …",6,2020.9.16 0:34,공권력 좀 강회해주세요. 멍하니 손 놓고 바라만 보는 우리나라 경찰보면 안쓰럽습니다. 안에 3명 있었는데 상황이 진짜 위험했으면 생각만해도 끔찍합니다. 글구 이런 정신이상자는 엉구 사회외 격리될수 있도록 해야지. 얼마뒤 또 그럴 가능성 농후한데. 언젠가 인명사고 납니다요. 이러다,67,0
"[영상]車 돌진뒤 20분간 편의점 뭉개…30대女 난동, 공포탄 …경기도 평택에 있는 한 편의점 안으로 승용차를 몰고 돌진한 뒤 앞뒤로 운전하는 등 난동을 벌인 30대 여성 운전자가 경찰에 …",7,2020.9.16 0:34,경찰 욕하시는분들 봐주세요공권력이 바닥인데 경찰이 저기서 뭘 해야해요? 순찰차로 차 못나오게 막은게 최선인데 아무 무장 없이 다가가서 경찰이 다쳐야 잘 한겁니까?? 그렇다고 총 쏴서 잘못하다가 피의자가 맞아서 다치거나 죽으면 국가나 조직에서 책임져주지도 않고 온전히 본인이 책임져서 직위해제나 파면당하는게 현실인데 .. 공권력이 약해서 뭐 할 수가 없습니다,72,7
"[영상]車 돌진뒤 20분간 편의점 뭉개…30대女 난동, 공포탄 …경기도 평택에 있는 한 편의점 안으로 승용차를 몰고 돌진한 뒤 앞뒤로 운전하는 등 난동을 벌인 30대 여성 운전자가 경찰에 …",8,2020.9.16 0:34,편의점운영햇던사람였습니다.범죄도있엇고 코로나도 타격잇어편의점은 접엇엇죠.그런데말입니다.진상행패범죄는 항상 있을겁니다.진상행패사건들이 맨날있어결국에는야간은 영업안햇엇습니다.거히4년동안스트레스받아정신치료받엇고진짜댓글 중에 혼자는 안하는게 낮다고 위험하다고 이런댓글잇는데 진짜 맞습니다 저도 죽을 수도 잇겟구나 한두번 아니고 이때까지 전체1500일중 500일정도는 괴롭힘 당한거같습니다 체력도 안좋고 편의점하시는분들은 옆에파출소 있는데도 행패는 그대로 입니다.코로나로 이계기로 야간행패진상은 좀 사라질겁니다.편의점점주님들 그래도 힘내세요.,50,3
"[영상]車 돌진뒤 20분간 편의점 뭉개…30대女 난동, 공포탄 …경기도 평택에 있는 한 편의점 안으로 승용차를 몰고 돌진한 뒤 앞뒤로 운전하는 등 난동을 벌인 30대 여성 운전자가 경찰에 …",9,2020.9.16 0:34,경찰보고 뭐하냐 뭐냐 떠들지마라 뭣만하면 과잉대응이다 뭐다 징계먹고 승진도 못하고 🐕똥될텐데 어떻하라고? 공포탄 쐇어도 왜쐇냐 다른방법이 잇지 않냐 감찰 뜰거다.. 공권력이 개같은데 경찰이 일을 할수잇겟냐,48,2
"[영상]車 돌진뒤 20분간 편의점 뭉개…30대女 난동, 공포탄 …경기도 평택에 있는 한 편의점 안으로 승용차를 몰고 돌진한 뒤 앞뒤로 운전하는 등 난동을 벌인 30대 여성 운전자가 경찰에 …",10,2020.9.16 0:34,뽕쟁이 포르쉐에 분노조절 제네시스... 진짜 별 이상한 인간들 많네,36,1
"[영상]車 돌진뒤 20분간 편의점 뭉개…30대女 난동, 공포탄 …경기도 평택에 있는 한 편의점 안으로 승용차를 몰고 돌진한 뒤 앞뒤로 운전하는 등 난동을 벌인 30대 여성 운전자가 경찰에 …",11,2020.9.16 0:34,"세상이 점점 무법천지가 되어가고 있다 18ㄱ 벤츠녀, 포르쉐남, 제네시스녀 셋다 평생 한방에 가둬라",35,0
"[영상]車 돌진뒤 20분간 편의점 뭉개…30대女 난동, 공포탄 …경기도 평택에 있는 한 편의점 안으로 승용차를 몰고 돌진한 뒤 앞뒤로 운전하는 등 난동을 벌인 30대 여성 운전자가 경찰에 …",12,2020.9.16 0:34,저 동네사람들 왈 !! 택배 저곳에 맏겨둔거 분실 !! 주인년이 모르겟다 배쩨라 한게 한두건이 아니라고 함 .. 얼마나 열 받앗으면 저지경을 만들어 놓앗을까요 . 조사해서 편의점 주인 절도죄도 조사 해야 할듯,69,36
"[영상]車 돌진뒤 20분간 편의점 뭉개…30대女 난동, 공포탄 …경기도 평택에 있는 한 편의점 안으로 승용차를 몰고 돌진한 뒤 앞뒤로 운전하는 등 난동을 벌인 30대 여성 운전자가 경찰에 …",13,2020.9.16 0:34,돈 있다고 맘대로 하면 눈 튀어나올 정도로 벌금때리는 법을 만들어야 하지 않을까?,28,1
"[영상]車 돌진뒤 20분간 편의점 뭉개…30대女 난동, 공포탄 …경기도 평택에 있는 한 편의점 안으로 승용차를 몰고 돌진한 뒤 앞뒤로 운전하는 등 난동을 벌인 30대 여성 운전자가 경찰에 …",14,2020.9.16 0:34,공권력에 응하지 않으면 미국처럼 즉시 경고 후 공포탄 쏘고 바로 실탄 쏠 수 있게 해라. 20분동안 경찰과 시민들은 얼마나 공포스러웠겠냐.,23,1
"[영상]車 돌진뒤 20분간 편의점 뭉개…30대女 난동, 공포탄 …경기도 평택에 있는 한 편의점 안으로 승용차를 몰고 돌진한 뒤 앞뒤로 운전하는 등 난동을 벌인 30대 여성 운전자가 경찰에 …",15,2020.9.16 0:34,미국이 참 부럽다 미국이었다면 제네시스 운전석이 벌집이 되었을텐데,21,0
"[영상]車 돌진뒤 20분간 편의점 뭉개…30대女 난동, 공포탄 …경기도 평택에 있는 한 편의점 안으로 승용차를 몰고 돌진한 뒤 앞뒤로 운전하는 등 난동을 벌인 30대 여성 운전자가 경찰에 …",16,2020.9.16 0:34,코로나로 집에만 있으니 참다못한 정신병자들이 속속들이 나와 사고치기 시작하네요.음주에 뺑소니에 대마에 가지가지..법이 너무 허술하고 죄없는 국민만 희생당합니다.추미애 아들이고 조국 딸이고 관심없고 입법 좀 잘합시다. 국민 좀 살립시다. 가해자를 위한 법 말고 피해자를 위한 법을 만들어주세요. 가해자 인권만 있는 이 나라...,18,0
"[영상]車 돌진뒤 20분간 편의점 뭉개…30대女 난동, 공포탄 …경기도 평택에 있는 한 편의점 안으로 승용차를 몰고 돌진한 뒤 앞뒤로 운전하는 등 난동을 벌인 30대 여성 운전자가 경찰에 …",17,2020.9.16 0:34,"저건 손괴죄가 아니라, ""살인미수"" 아니냐? 편의점 안에 사람이 있는걸 알고도 차로 돌진했다면 죽일 생각도 있었던거다.",17,0
"[영상]車 돌진뒤 20분간 편의점 뭉개…30대女 난동, 공포탄 …경기도 평택에 있는 한 편의점 안으로 승용차를 몰고 돌진한 뒤 앞뒤로 운전하는 등 난동을 벌인 30대 여성 운전자가 경찰에 …",18,2020.9.16 0:34,"나라 잘만나서 살아있네요, 저여자 미국에서 저짓거리했으면 지금 저 자동차 벌집되고 물론 사람을 상대로 갈기진 않겠지만, 자동차 걸레되고 질질끌려 나왔을텐데, 그리고 감옥에 100년 있게되죠.",17,1
"[영상]車 돌진뒤 20분간 편의점 뭉개…30대女 난동, 공포탄 …경기도 평택에 있는 한 편의점 안으로 승용차를 몰고 돌진한 뒤 앞뒤로 운전하는 등 난동을 벌인 30대 여성 운전자가 경찰에 …",19,2020.9.16 0:34,요즘 30대 여자들 문제 많네요ㅋㅋㅋ인천 음주운전도 그렇고,16,0
"[영상]車 돌진뒤 20분간 편의점 뭉개…30대女 난동, 공포탄 …경기도 평택에 있는 한 편의점 안으로 승용차를 몰고 돌진한 뒤 앞뒤로 운전하는 등 난동을 벌인 30대 여성 운전자가 경찰에 …",20,2020.9.16 0:34,20분동안 아무것도 안하고 멀뚱멀뚱 구경하고 있으면 굳이 경찰이 필요하나싶음. 저러다가 밀어버려서 사람 죽을때까지 가만히 있는거임?? 돌발사건 일어날시 메뉴얼 그런거 안배웠음? 공무원시험합격해서 그냥하는거지 경찰로서 사명감 가지고 하는 애가 있기는 있냐??적성에 안맞으면 그만두는게 맞는거 아님?? 공무원한다고 굳이 적성에도 맞지않은 직업을 해가지고.. 이런 쓸모없는 경찰들은 다 짤라야함,27,12
"개그맨 김형인, 도박장 개설 혐의로 재판 넘겨져",1,2020.9.16 0:34,꼭 생긴대로 처 놀고있다 저런넘은 구속시켜 사회로 부터 격리해라,1286,24
"개그맨 김형인, 도박장 개설 혐의로 재판 넘겨져",2,2020.9.16 0:34,유튜브에서 깡패들이랑 다니더니,475,15
"개그맨 김형인, 도박장 개설 혐의로 재판 넘겨져",3,2020.9.16 0:34,관상은 싸이언스.,473,16
"개그맨 김형인, 도박장 개설 혐의로 재판 넘겨져",4,2020.9.16 0:34,도박하다 걸린거야~ 그런거야~~ 가방 가는거야~,185,12
"개그맨 김형인, 도박장 개설 혐의로 재판 넘겨져",5,2020.9.16 0:34,관상은 거짓말 안한다..,182,14
"개그맨 김형인, 도박장 개설 혐의로 재판 넘겨져",6,2020.9.16 0:34,깜빵다녀온 깡패출신 섭외해서 깜빵썰 푸는 유투브 운영하시더니 진짜 깜빵가겠네 이분 유투브하시면서 깜빵공부 많이하셔서 깜빵생활 잘하실거에요,59,2
"개그맨 김형인, 도박장 개설 혐의로 재판 넘겨져",7,2020.9.16 0:34,사진보고 유승준인줄 알았다,38,3
"개그맨 김형인, 도박장 개설 혐의로 재판 넘겨져",8,2020.9.16 0:34,관상이 이창명 같다,36,4
"개그맨 김형인, 도박장 개설 혐의로 재판 넘겨져",9,2020.9.16 0:34,먹식이가 신고했나보내 ㅎㅎㅎ,32,2
"개그맨 김형인, 도박장 개설 혐의로 재판 넘겨져",10,2020.9.16 0:34,둘중하나다 경쟁 하우스가 신고 했거나 돈 잃은 놈이 신고 했거나ㅋ,26,1
"개그맨 김형인, 도박장 개설 혐의로 재판 넘겨져",11,2020.9.16 0:34,도박쟁이들은 걸으면 신발에서 도박도박 소리가 납니다!,23,2
"개그맨 김형인, 도박장 개설 혐의로 재판 넘겨져",12,2020.9.16 0:34,"김형인,윤미향,추미애보면 진심 관상은 과학이상인듯",34,15
"개그맨 김형인, 도박장 개설 혐의로 재판 넘겨져",13,2020.9.16 0:34,"또또 연예인 고발로 물타기 시작한다. 이정도 가지고는 추미애, 윤미향, 조국 덮기에는 약하지. 좀더 쎈거 가져와라. 후딱 하나 만들든가",42,26
"개그맨 김형인, 도박장 개설 혐의로 재판 넘겨져",14,2020.9.16 0:34,개그맨중에 이상한 놈들 많네. 도박장. 차량절도. 화장실 몰카. 또 뭐 있니?,15,2
"개그맨 김형인, 도박장 개설 혐의로 재판 넘겨져",15,2020.9.16 0:34,검색순위가 추미애를 완전 없애버렸네~추미애 보호하려고 애쓴다,100,88
"개그맨 김형인, 도박장 개설 혐의로 재판 넘겨져",16,2020.9.16 0:34,범죄와의 전쟁 최민식이냐? ㅋㅋㅋㅋㅋ 유튜브 건달들이랑 어울리면서 형님 소리 듣다 보니 지가 진짜 건달인 줄 알고 나대버리네; 아 너 같은 애들을 반달이라고 한다며? 주제 파악 좀 하고 살자..,14,2
"개그맨 김형인, 도박장 개설 혐의로 재판 넘겨져",17,2020.9.16 0:34,깡패들이랑 징역설풀더니만 직접풀게생겼네,8,1
"개그맨 김형인, 도박장 개설 혐의로 재판 넘겨져",18,2020.9.16 0:34,유승준 닮음,7,0
"개그맨 김형인, 도박장 개설 혐의로 재판 넘겨져",19,2020.9.16 0:34,조폭하고 유튜찍더니..,7,0
"개그맨 김형인, 도박장 개설 혐의로 재판 넘겨져",20,2020.9.16 0:34,콩밥먹는거야~그런거야~,7,1
"여론 들끓자…당직병 공익신고 아니라던 권익위 ""조사 착수""",1,2020.9.16 0:34,이런걸 권익위가 보호하지 않으면 대체 권익위는 누구를 보호하는 것인가? 정부를 위한 권익위다 문정부 사법 검찰 언론 모든걸 다 확실히 장악하셨네. 이나라에 더이상 정의나 진실은 죽었다고 본다. 정부입장과 여당 입맛에만 맞는 권익위는 더이상 존재의 이유가 없지않을까?,1990,16
"여론 들끓자…당직병 공익신고 아니라던 권익위 ""조사 착수""",2,2020.9.16 0:34,"""당직사병은 우리들의 아들이다. 털 끝 하나라도 건드리지 마라.""",1087,14
"여론 들끓자…당직병 공익신고 아니라던 권익위 ""조사 착수""",3,2020.9.16 0:34,역대급 정권이다 최순실은 양반이네,768,10
"여론 들끓자…당직병 공익신고 아니라던 권익위 ""조사 착수""",4,2020.9.16 0:34,문씨가 임명한 권익위원장 ~~~ 그렇지~~ㅠ,289,2
"여론 들끓자…당직병 공익신고 아니라던 권익위 ""조사 착수""",5,2020.9.16 0:34,밥값도못하는 관익위 세금 축내지말고.없애라.,262,1
"여론 들끓자…당직병 공익신고 아니라던 권익위 ""조사 착수""",6,2020.9.16 0:34,"민주주의는 더 퇴보한것 같아요. 성공한 정부가 되길 바랬는데, 최악의 정부가 될듯 합니다. 오지게 자기 패거리만 챙기니...패거리정권이라 칭해도 될듯...",69,0
"여론 들끓자…당직병 공익신고 아니라던 권익위 ""조사 착수""",7,2020.9.16 0:34,"🤮🥶🤢추미애장관 아들 서일병 구할려고 청와대.민주당과 국방부.외교부등 각부처도 부족해서권익위도 동참하여 서일병 구하기에 나섰군..🤢🤢🥶도대체 추미애장관 아들이 누구길래 , 온 국가기관들이 서일병 장관아들 옹호에 나서는 코미디가 21세기 대한민국에서 벌어지고 있습니다. 🤩🤩🤩국민여러분! 이게 나랍니까?",54,0
"여론 들끓자…당직병 공익신고 아니라던 권익위 ""조사 착수""",8,2020.9.16 0:34,"이정부의 최대 단점이 여론을 너무 의식한다. 간을 보고 아니다 싶으면 이리갔다, 저리 갔다. 한마디로 줏대가 없다. 이러니 모든 일이 중구난방,땜질식 이다. 가장 대표적인게 부동산정책과 검찰개혁이다. 역사상 가장 흠이 많은 정권중 하나임은 분명하다.",52,0
"여론 들끓자…당직병 공익신고 아니라던 권익위 ""조사 착수""",9,2020.9.16 0:34,집권 3년만에 이렇게 망가지다니 그저 놀라울뿐이다.,48,1
"여론 들끓자…당직병 공익신고 아니라던 권익위 ""조사 착수""",10,2020.9.16 0:34,캐나다로 먹튀한 윤지오보고 공익제보자라고 안민석 털보 김어중이 엄청나게 빨아댔지 윤지오도 공익제보자라고 하는 마당에 A씨가 공익제보자 자격이 안된다는게 말이 되냐고,47,0
